japanese,kana,english
その村までたった3マイルしかない。,その むら まで たった 3マイル しか ない。,It's only three miles to the village.
古代では疫病でたくさんの人が死んだ。,こだい では えきびょう で たくさん の ひと が しんだ。,"In ancient times, plagues killed many people."
彼はロンドンでたくさん写真を撮った。,かれ は ロンドン で たくさん しゃしん を とった。,He took many pictures in London.
聞こえませんよ。,きこえません よ。,I can't hear you.
私は何も見えません。,わたし は なに も みえません。,I don't see anything.
物がよく見えません。,もの が よく みえません。,I can't see well.
彼はうまく歌えません。,かれ は うまく うたえません。,He can't sing well.
どいてもらえませんか。,どいてもらえません か。,Could you please move out of my way?
月の裏側は見えません。,つき の うらがわ は みえません。,We can't see the other side of the moon.
よく聞こえませんでした。,よく きこえませんでした。,I didn't hear you.
手伝ってもらえませんか。,てつだってもらえません か。,Will you please help me?
私は物がよく見えません。,わたし は もの が よく みえません。,I can't see well.
忙しいので手伝えません。,いそがしい ので てつだえません。,I can't help you because I am busy.
雑音で何も聞こえません。,ざつおん で なに も きこえません。,I can't hear anything because of the noise.
塩を取ってもらえませんか。,しお を とってもらえません か。,"Pass me the salt, will you?"
道路地図をもらえませんか。,どうろ ちず を もらえません か。,"May I have a road map, please?"
値引きしてもらえませんか。,ねびき してもらえません か。,Could you give me a discount?
道を教えてもらえませんか。,みち を おしえてもらえません か。,Will you please show me the way?
ドアを閉めてもらえませんか。,ドア を しめてもらえません か。,Will you please shut the door?
住所を教えてもらえませんか。,じゅうしょ を おしえてもらえません か。,Can you tell me your address?
この口が裂けても言えません！,この くち が さけても いえません！,I will never tell!
お皿を洗ってもらえませんか？,お さら を あらってもらえません か？,"Could you do the dishes, please?"
お願いを聞いてもらえませんか。,おねがい を きいてもらえません か。,Could you do me a favor?
どうでしたか。,どう でした か。,How was it?
安いようでした。,やすい よう でした。,It seemed to be cheap.
血は鮮血でした。,ち は せんけつ でした。,The blood was bright red.
私は教師でした。,わたし は きょうし でした。,I was a teacher.
お疲れ様でした。,おつかれさま でした。,Thanks for your hard work.
ご馳走様でした。,ごちそうさま でした。,That was a delicious meal.
昨日病気でした。,きのう びょうき でした。,Yesterday I was ill.
旅行どうでした？,りょこう どう でした？,How was your trip?
私は会員でした。,わたし は かいいん でした。,I was a member.
変化の時でした。,へんか の とき でした。,It was time for a change.
お疲れさまでした。,おつかれさま でした。,Thank you!
いつもそうでした。,いつも そう でした。,It's always been like that.
夏はどうでしたか。,なつ は どう でした か。,How was your summer?
旅行どうでしたか？,りょこう どう でした か？,How was your trip?
どうでした、旅行？,どう でした、りょこう？,How was your trip?
旅行はどうでした？,りょこう は どう でした？,How was your trip?
嬉しい驚きでした。,うれしい おどろき でした。,I was pleasantly surprised.
いい旅行でしたか？,いい りょこう でした か？,Was it a nice trip?
専攻は何でしたか？,せんこう は なに でした か？,What was your major?
トムは短命でした。,トム は たんめい でした。,Tom didn't live a long life.
くそっ、ヒューズがとんだよ！,く そっ、ヒューズ が とんだ よ！,"Shit, I blew a fuse!"
お前もとんだとばっちりだったよな。,おまえ も とんだ とばっちり だった よな。,"You got involved in something bad, huh?"
トムがテレビをつけたとたんにヒューズがとんだ。,トム が テレビ を つけた とたん に ヒューズ が とんだ。,No sooner had Tom turned on the TV than the fuse blew.
爆発がとてもすさまじかったので、屋根が吹っとんだ。,ばくはつ が とても すさまじかっ た ので、やね が ふっとんだ。,Such was the explosion that the roof was blown off.
わかります。,わかります。,I understand.
分かりますか。,わかります か。,Do you follow?
わかりますか。,わかります か。,Do you understand?
分かりますか？,わかります か？,Is it clear?
すぐわかりますよ。,すぐ わかります よ。,You can't miss it.
とても助かります。,とても たすかります。,That helps a lot.
どれ位かかりますか。,どれい かかります か。,How long does it take?
きっと見つかりますよ。,きっと みつかります よ。,You can't miss it.
手数料はかかりますか。,てすうりょう は かかります か。,Is there a handling charge?
1日か2日かかります。,1にち か 2にち かかります。,Give me a day or two.
さすが君は分かります。,さすが きみ は わかります。,Of course you understand.
何日ぐらいかかりますか。,なんにち ぐらい かかります か。,How long will it take?
その違いが分かりますか。,その ちがい が わかります か。,Can you see the difference?
いま何時か分かりますか？,いま なんじ か わかります か？,Do you know what time it is?
今日が何日か分かりますか？,きょう が なんにち か わかります か？,Do you know what day it is?
僕の言うことわかりますか？,ぼく の いう こと わかります か？,Do you understand me?
言ってることがわかりますか。,いってる こと が わかります か。,Am I making myself clear?
私は日本語が少し分かります。,わたし は にほんご が すこし わかります。,I understand Japanese a little.
彼が誰だったかわかりますか。,かれ が だれ だった か わかります か。,Do you know who he was?
メアリーは中国語が分かります。,メアリー は ちゅうごくご が わかります。,Mary understands Chinese.
生物学は好きになれません。,せいぶつがく は すき に なれません。,I never liked biology.
この暑さでは何をする気にもなれません。,この あつさ では なに を する き にも なれません。,"When it's this hot, I don't feel like doing anything."
急がなくちゃ。,いそがなく ちゃ。,You need to hurry.
行かなくちゃ。,いかなく ちゃ。,I have to go.
戻らなくては。,もどらなく ては。,I must go back.
休まなくては。,やすまなく ては。,I need to rest.
雪がなくなった。,ゆき が なくなった。,The snow has disappeared.
間もなく日没だ。,まもなく にちぼつ だ。,The sunset is soon.
着替えなくちゃ。,きがえなく ちゃ。,I have to change my clothes.
会えなくて淋しい。,あえなく て さびしい。,I miss you.
財布をなくしたの。,さいふ を なくした の。,I have lost my wallet.
労なくして益なし。,ろう なく して えき なし。,"No pain, no gain."
果物をご遠慮なく。,くだもの を ご えんりょなく。,Please help yourself to some fruit.
もう行かなくちゃ。,もう いかなく ちゃ。,I have to leave now.
どうぞお構いなく。,どうぞ おかまいなく。,Please don't bother.
私は傘をなくした。,わたし は かさ を なくした。,I have lost my umbrella.
家に帰らなくちゃ。,いえ に かえらなく ちゃ。,I have to go home.
私は鍵をなくした。,わたし は かぎ を なくした。,I have lost my key.
勉強しなくっちゃ。,べんきょう しなくっ ちゃ。,I have to study.
着替えしなくちゃ。,きがえ しなく ちゃ。,I have to dress up.
謝んなくていいよ。,あやまん なく て いい よ。,You don't have to apologize.
謝らなくていいよ。,あやまらなく て いい よ。,You don't have to apologize.
いらないです。,いらないです。,I don't need it.
とんでもない！,とんでも ない！,No way!
とんでもありません！,とんでも ありません！,No way!
とんでもございません！,とんでも ございません！,No way!
彼は完全だなんてとんでもない。,かれ は かんぜん だ なんて とんでも ない。,He is far from perfect.
トムはとんでもない食いしん坊です。,トム は とんでも ない くいしんぼう です。,Tom's gluttony knows no bounds.
トムがとんでもない二日酔いをしてしまいました。,トム が とんでも ない ふつかよい を してしまいました。,Tom had a hideous hangover.
レポートの締切が近いので、私はとんでもなく忙しい。,レポート の しめきり が ちかい ので、わたし は とんでも なく いそがしい。,I am terribly busy because the report deadline is near.
彼はぐるりとふりかえった。,かれ は ぐるり と ふりかえった。,He turned around.
トムはよく物をなくす。,トム は よく もの を なくす。,Tom tends to lose things.
タイポみると答える気なくす。,タイ ポ みる と こたえる き なくす。,When I see typos I lose interest in answering.
楽しんでね。,たのしんでね。,Have fun.
楽しんでるよ。,たのしんでる よ。,I'm amused.
さあ楽しんで。,さあ たのしんで。,Now have fun.
楽しんできてね。,たのしんできてね。,Have a good time.
楽しんでますか。,たのしんで ます か。,Are you enjoying yourself?
楽しんできなさい。,たのしんできなさい。,Have fun.
話を楽しんでいる。,はなし を たのしんでいる。,We enjoy talking.
目一杯楽しんでね！,め いちはい たのしんでね！,Have as much fun as you can!
トムは楽しんでいる。,トム は たのしんでいる。,Tom enjoyed doing that.
休日を楽しんできてね。,きゅうじつ を たのしんできてね。,Enjoy your holidays.
楽しんできてください。,たのしんできてください。,Have a nice time.
旅行、楽しんできてね。,りょこう、たのしんできてね。,Enjoy your trip.
休暇は楽しんでますか。,きゅうか は たのしんで ます か。,Are you enjoying the holidays?
楽しんでいるようだね。,たのしんでいる よう だ ね。,"You're enjoying yourself, aren't you?"
街を楽しんでいるかい？,まち を たのしんでいる かい？,Are you enjoying the city?
彼は頭痛で苦しんでいる。,かれ は ずつう で くるしんでいる。,He is suffering from a headache.
彼女、よく親しんできた。,かのじょ、よく したしんできた。,I got to know her REAL well.
旅行を楽しんでくださいね！,りょこう を たのしんでください ね！,Please enjoy your trip.
気をつけて、楽しんできてね。,き を つけて、たのしんできてね。,"Take care of yourself, and have a good time!"
何をそんなに悲しんでいるの。,なに を そんなに かなしんでいる の。,What makes you so sad?
卵３個と１カップの砂糖をまぜてください。,たまご ３こ と １ カップ の さとう を まぜてください。,Mix three eggs and a cup of sugar.
つづく。,つづく。,To be continued.
このおたんこなす！,この おたんこなす！,You idiot!
お金は何でもこなす。,おかね は なに でも こなす。,Money will do anything.
私は彼を敵とみなす。,わたし は かれ を てき と みなす。,I regard him as an enemy.
彼はドイツなまりの英語をはなす。,かれ は ドイツ なまり の えいご を はなす。,He speaks English with a German accent.
彼にはその仕事をこなす能力がある。,かれ には その しごと を こなす のうりょく が ある。,He has the ability to do the work.
何をやるにしても、彼は上手にこなす。,なに を やる に しても、かれ は じょうず に こなす。,"Regardless what he does, he does it well."
仕事中毒者は休日を時間の無駄とみなす。,しごと ちゅうどくしゃ は きゅうじつ を じかん の むだ と みなす。,Workaholics view holidays as a waste of time.
彼にはその仕事をきちんとこなす能力がない。,かれ には その しごと を きちんと こなす のうりょく が ない。,He doesn't have the ability to do the work properly.
トムのやることなすこと全てが気に食わない。,トム の やる こと なす こと すべて が き に くわない。,I don't like anything Tom does.
彼には、その仕事をきちんとこなす能力はない。,かれ には、その しごと を きちんと こなす のうりょく は ない。,He doesn't have the ability to do the work properly.
こんなすばらしい映画を見たことがありますか。,こんな すばらしい えいが を みた こと が あります か。,Have you ever seen such a nice film?
二人の男たちは互いに罪をなすりつけあっていた。,ににん の おとこたち は たがいに つみ を なすりつけあっていた。,The two men blamed each other for the crime.
君の言うことなすこと、私にはさっぱりわからない。,きみ の いう こと なす こと、わたし には さっぱり わからない。,I can make nothing of what you do or say.
一度に複数の仕事をこなすのは得意ではありません。,いちど に ふくすう の しごと を こなす の は とくい で は ありません。,I'm not good at multitasking.
宗教を庶民は真、賢者は偽、支配者は有用と見なす。,しゅうきょう を しょみん は しん、けんじゃ は にせ、しはいしゃ は ゆうよう と みなす。,"Religion is regarded by the common people as true, by the wise as false, and by the rulers as useful."
「雨がすぐあがるでしょうか」「あがらないと思うよ」,「あめ が すぐ あがるでしょう か」「あがらない と おもう よ」,"Will it stop raining soon? ""I'm afraid not."""
私の悪性のかぜがなおった。,わたし の あくせい の かぜ が なおった。,I have recovered from my bad cold.
彼女は両手で顔をおおった。,かのじょ は りょうて で かお を おおった。,She buried her face in her hands.
彼女は電話の送話口を手でおおった。,かのじょ は でんわ の そうわぐち を て で おおった。,She covered the mouthpiece of the phone with her hand.
君にまかせるよ。,きみ に まかせる よ。,I'm leaving it to you.
誰もが詩人になれるものでもない。,だれ もが しじん に なれる もの で も ない。,Not everyone can be a poet.
誰もが詩人になれるとは限らない。,だれ もが しじん に なれる とは かぎらない。,Not everyone can be a poet.
誰でも詩人になれるわけではない。,だれ でも しじん に なれる わけ で は ない。,Not everyone can be a poet.
だれもが詩人になれるわけではない。,だれ もが しじん に なれる わけ で は ない。,Not everyone can be a poet.
何かお力になれることありませんか？,なに か おちから に なれる こと ありません か？,Is there anything that I can do to help you?
君は非常に優秀な弁護士になれる気がする。,きみ は ひじょう に ゆうしゅう な べんごし に なれる き が する。,I have a feeling you'll be a very good lawyer.
彼は弁護士になれるという希望に執着していた。,かれ は べんごし に なれる という きぼう に しゅうちゃく していた。,He clung to the hope that he could be a lawyer.
愛してるの響きだけで、強くなれる気がするよ。,あいしてる の ひびき だけ で、つよく なれる き が する よ。,Just the sound of 'I love you' makes me feel stronger.
私たちは親友になれるかもしれないと思います。,わたしたち は しんゆう に なれる かも しれない と おもいます。,I think we could be great friends.
この家は砦でもお城でもないが、少し冷静になれる。,この いえ は とりで でも お しろ でも ない が、すこし れいせい に なれる。,"This house is no fortress or castle, but it still instills a sense of security."
すぐ行きます。,すぐ いきます。,I'll be along soon.
毎年行きます。,まいとし いきます。,I go every year.
私が行きます。,わたし が いきます。,I'll go.
喜んで行きます。,よろこんでいきます。,I'll be glad to come.
音楽を聴きます。,おんがく を ききます。,I listen to music.
いま、行きます。,いま、いきます。,I am coming.
考えておきます。,かんがえておきます。,I'll have to let you know.
庭から行きます。,にわ から いきます。,I'm coming from the garden.
海外へ行きます。,かいがい へ いきます。,I'm going abroad.
すぐ戻ってきます。,すぐ もどってきます。,I will be back soon.
いつ頃着きますか。,いつ ころ つきます か。,When will they arrive?
私は先に行きます。,わたし は さき に いきます。,I will go on ahead.
私は毎日歩きます。,わたし は まいにち あるきます。,I walk every day.
予約はできますか。,よやく は できます か。,Could I make a reservation?
涙が出てきますよ。,なみだ が でてきます よ。,My eyes are watering.
どこに行きますか？,どこ に いきます か？,Where are you going to?
どこへ行きますか。,どこ へ いきます か。,Where are you going?
どこで書きますか。,どこ で かきます か。,Where do you write?
また戻ってきます。,また もどってきます。,I'll be back.
学校まで歩きます。,がっこう まで あるきます。,I walked as far as the school.
うつむかないで。,うつむかない で。,Don't slouch.
通信手段が機能しなくなった。,つうしん しゅだん が きのう しなく なった。,Communications broke down.
彼は病気で来られなくなった。,かれ は びょうき で こられなく なった。,He couldn't come because he was sick.
私は債務を果たせなくなった。,わたし は さいむ を はたせなく なった。,I can no longer fulfill my obligations.
飛行機はまもなく見えなくなった。,ひこうき は まもなく みえなく なった。,The airplane soon went out of sight.
にっちもさっちもいかなくなった。,にっちもさっちも いかなく なった。,We're up against the wall.
錠剤のおかげで痛みがなくなった。,じょうざい の おかげ で いたみ が なくなった。,The pain went away because I took the pills.
百歳の誕生日の数日前になくなった。,ひゃくさい の たんじょうび の すうにち まえ に なくなった。,He died within a few days of his hundredth birthday.
いなくなった猫はまだ見つかってない。,いなく なった ねこ は まだ みつかってない。,The missing cat has not been found yet.
彼女の自動車は途中で動かなくなった。,かのじょ の じどうしゃ は とちゅう で うごかなく なった。,Her car broke down on the way.
妙なことに、彼女は突然いなくなった。,みょう な こと に、かのじょ は とつぜん いなく なった。,"Strange to say, she suddenly disappeared."
病気で動かれなくなったのではないかな。,びょうき で うごかれなく なった の で は ない かな。,I wonder if she might not have become unable to move because of an illness.
彼女は森の中で右も左も分からなくなった。,かのじょ は もり の なか で みぎ も ひだり も わからなく なった。,She lost her way in the forest.
落石で村へ通じる唯一の道が通れなくなった。,らくせき で むら へ つうじる ゆいいつ の みち が とおれなく なった。,Fallen rocks cut off the only access to the village.
どうしてあなたは雑誌を読まなくなったのですか。,どうして あなた は ざっし を よまなく なった の です か。,Why didn't you read the magazine?
彼女がもう私を愛さなくなった理由がわからない。,かのじょ が もう わたし を あいさなく なった りゆう が わからない。,I don't understand why she doesn't love me anymore.
ヘッドホンが壊れたので夜音楽を聴けなくなった。,ヘッドホン が こわれた ので よる おんがく を きけなく なった。,I can't listen to music at night anymore because my headphones broke.
音は次第に小さくなり、ついには聞こえなくなった。,おと は しだいに ちいさく なり、ついに は きこえなく なった。,"The noise grew fainter, till it was heard no more."
彼女は自分自身の力に頼らなければならなくなった。,かのじょ は じぶん じしん の ちから に たよらなけれ ばならなく なった。,She had to rely upon her inner strength.
手伝ってくれますか。,てつだってくれます か。,Could you help?
窓を開けてくれますか。,まど を あけてくれます か。,"Open the window, please."
私を助けてくれますか。,わたし を たすけてくれます か。,Can you help me?
それを郵送してくれますか。,それ を ゆうそう してくれます か。,Will you send it by mail?
リモコンを取ってくれますか？,リモコン を とってくれます か？,Could you hand me the remote?
たぶんトムが助けてくれます。,たぶん トム が たすけてくれます。,Maybe Tom will help.
頼めばトムが助けてくれますよ。,たのめば トム が たすけてくれます よ。,You can ask Tom for help.
これを持って行ってくれますか？,これ を もっていってくれます か？,Please take this away.
彼女がピアノで伴奏してくれます。,かのじょ が ピアノ で ばんそう してくれます。,She will accompany me on the piano.
寝室の掃除を手伝ってくれますか？,しんしつ の そうじ を てつだってくれます か？,Would you help me clean the bedroom?
旅行の総費用を計算してくれますか。,りょこう の そう ひよう を けいさん してくれます か。,Can you work out the total cost of the trip?
トムはいつも私たちを助けてくれます。,トム は いつも わたしたち を たすけてくれます。,Tom always helps us.
あなたがそれを理解してくれますように。,あなた が それ を りかい してくれます よう に。,I hope you understand that.
彼女が美味しい夕食を作ってくれますよ。,かのじょ が おいしい ゆうしょく を つくってくれます よ。,She will make us a nice dinner.
私に電話するように彼女に伝えてくれますか？,わたし に でんわ する よう に かのじょ に つたえてくれます か？,Could you ask her to call me?
ダンスに行ってる間、母が赤ちゃんを見てくれます。,ダンス に いってる ま、はは が あかちゃん を みてくれます。,My mother will attend to the baby while I go to the dance.
手足がむくんでいます。,てあし が むくんでいます。,My hands and legs are swollen.
栗の皮をむく作業に一苦労した。,くり の かわ を むく さぎょう に ひとくろう した。,It's a hassle to take the husks off of chestnuts.
彼は大変ねむくて、夕刊も読めなかった。,かれ は たいへん ねむく て、ゆうかん も よめなかった。,He was too sleepy to read the evening newspaper.
授業をしながらジャガイモの皮をむく先生もいる。,じゅぎょう を しながら ジャガイモ の かわ を むく せんせい も いる。,Some teachers peel potatoes while teaching.
わかった。,わかった。,I see.
わかったぞ！,わかった ぞ！,I understand.
トムはわかった。,トム は わかった。,Tom understood.
わかった。ごめんなさい。,わかった。ごめんなさい。,Okay. Sorry.
何かわかったら電話下さい。,なに か わかったら でんわください。,Give me a ring if you find out anything.
