japanese,kana,english
とってもロマンチックだな～！,とっても ロマンチック だ な ～！,It's very romantic!
二日ほど休みをとります。,ににち ほど やすみ を とります。,I am taking a couple of days off.
夕食を何時にとりますか？,ゆうしょく を なんじ に とります か？,What time do you have dinner?
朝食はたいてい軽くとります。,ちょうしょく は たいてい かるく とります。,I usually have a light breakfast.
私は普段７時に朝食をとります。,わたし は ふだん ７じ に ちょうしょく を とります。,I usually have breakfast at seven.
私たちは6時半に朝食をとります。,わたしたち は 6じはん に ちょうしょく を とります。,We'll have breakfast at 6:30.
次の動詞はｔｏ不定詞だけを目的語にとります。,つぎ の どうし はｔｏふてい ことば だけを もくてきご に とります。,The following verbs only take the to-infinitive as their object.
こんなことにはなって欲しくなかった。,こんな こと には なって ほしく なかった。,I didn't want this to happen.
まだ学校へ行けるほど元気にはなっていません。,まだ がっこう へ いける ほど げんき には なっていません。,I'm not strong enough yet to go to school.
両親そろって空港まで私を見送ってくれた。,りょうしん そろって くうこう まで わたし を みおくってくれた。,Both my parents came to see me off at the airport.
この図書館には中国語の本がかなりそろっている。,この としょかん には ちゅうごくご の ほん が かなり そろっている。,This library has a large collection of Chinese books.
やってみる。,やってみる。,I try.
後でやって。,あとで やって。,Do it later.
やってみて。,やってみて。,Try it out.
やってみた。,やってみた。,I tried.
何やってんの？,なに やって ん の？,What are you doing?
何やってるの？,なに やってる の？,What are you doing?
やってみよう！,やってみよう！,I try.
やってみたい？,やってみたい？,Do you want to try it?
急いでやって。,いそいでやって。,Make it quick.
やってはみた。,やっては みた。,I tried.
何やってんだか。,なに やって ん だ か。,What are you doing?
もう一回やって！,もう いちかい やって！,Do it again!
やってみようよ。,やってみよう よ。,Let's give it a try.
もう一度やって。,もういちど やって。,Do it again.
ちゃんとやって。,ちゃんと やって。,Do it right.
元気でやってるよ。,げんき で やってる よ。,I'm doing fine.
誰かがやってきた。,だれ かが やってきた。,Someone was coming!
彼女はやってみた。,かのじょ は やってみた。,She tried.
やってみましょう。,やってみましょう。,Let's do it.
トムとはつきあわないほうがいいよ。,トム とは つきあわない ほう が いい よ。,I advise you not to keep company with Tom.
着きましたよ。,つきました よ。,Here we are.
十分頂きました。,じゅうぶん いただきました。,I've had enough.
歩いてきました。,あるいてきました。,I came on foot.
はい、着きました。,はい、つきました。,Here we are.
７時に起きました。,７じ に おきました。,I got up at seven.
風邪をひきました。,かぜ を ひきました。,I have caught a cold.
中国からきました。,ちゅうごく から きました。,I came from China.
もう着きましたか。,もう つきました か。,Have you arrived yet?
トムは泣きました。,トム は なきました。,Tom wept.
準備ができました。,じゅんび が できました。,I'm ready.
彼はバスできました。,かれ は バス できました。,He came by bus.
夕御飯ができました。,ゆうごはん が できました。,Dinner is ready.
さあ、着きましたよ。,さあ、つきました よ。,This is it.
手紙は届きましたか。,てがみ は とどきました か。,Did you receive my letter?
値段は聞きましたか。,ねだん は ききました か。,Did you ask the price?
準備はできましたか?,じゅんび は できました か ?,Are you ready?
この前、行きました。,この まえ、いきました。,I went there recently.
チップを置きましたか。,チップ を おきました か。,Did you leave a tip?
彼らは彼に聞きました。,かれら は かれ に ききました。,They asked him.
万事準備ができました。,ばんじ じゅんび が できました。,Everything is ready.
抱きしめて。,だきしめて。,Give me a hug.
こらしめてやる。,こらしめてやる。,I'm gonna shoot him.
夢を抱きしめて。,ゆめ を だきしめて。,Embrace your dreams.
トムを抱きしめて。,トム を だきしめて。,Hug Tom.
ぎゅっと抱きしめて。,ぎゅっと だきしめて。,Hug me tight.
ドアをしめてください。,ドア を しめてください。,"Close the door, please."
あの窓をしめてくださいませんか。,あの まど を しめてくださいません か。,Would you be so kind as to shut that window?
離着陸の際にはシートベルトをしめて下さい。,りちゃくりく の さい には シートベルト を しめてください。,Please secure your seat belt during takeoff and landing.
使用後は必ずキャップをきちんとしめてください。,しようご は かならず キャップ を きちんと しめてください。,Please be sure to close the cap properly after use.
あの二股男を懲らしめてやるから、ちょっと待ってて!,あの ふたまた おとこ を こらしめてやるから、ちょっと まってて !,Just wait till I get my hands on that two-timing bastard!
少しやせました。,すこし やせました。,I've lost a little weight.
近いうちにお宅にうかがいます。,ちかい うち に お たく に うかがいます。,We'll visit you one of these days.
辞めます。,やめます。,I resign.
学びます。,まなびます。,I will learn.
待てます。,まてます。,I can wait.
遅れます。,おくれます。,I'll be late.
来ますか。,きます か。,Will you come?
泳げますか。,およげます か。,Can you swim?
もう寝ます。,もう ねます。,I will hit the sack.
失礼します。,しつれい します。,May I be excused?
兄がいます。,あに が います。,I have an older brother.
降参します。,こうさん します。,I give up.
私が出ます。,わたし が でます。,I'll get it.
出席します。,しゅっせき します。,I will join it!
乗りますか。,のります か。,Do you want a ride?
わかります。,わかります。,I understand.
一致します。,いっち します。,I agree.
降りますか？,おります か？,Are you getting off?
辞職します。,じしょく します。,I resign.
また来ます。,また きます。,I'll be back.
やりますか。,やります か。,Will you do it?
運動します。,うんどう します。,I work out.
妙な音が聞こえた。,みょう な おと が きこえた。,I heard a strange sound.
叫び声が聞こえた。,さけびごえ が きこえた。,I heard a scream.
誰かの口笛が聞こえた。,だれ かの くちぶえ が きこえた。,I heard someone whistle.
声が聞こえた気がした。,こえ が きこえた き が した。,I thought I heard voices.
電話が鳴る音が聞こえた。,でんわ が なる おと が きこえた。,I heard the phone ring.
たった今、銃声が聞こえた。,たったいま、じゅうせい が きこえた。,I heard a shot just now.
突然鋭い叫び声が聞こえた。,とつぜん するどい さけびごえ が きこえた。,"All at once, I heard a shrill cry."
彼が出ていく音が聞こえた。,かれ が でていく おと が きこえた。,I heard him go out.
遠くで雷が鳴ったのが聞こえた。,とおく で かみなり が なった の が きこえた。,I heard it thunder in the distance.
何かが地面に落ちる音が聞こえた。,なに かが じめん に おちる おと が きこえた。,I heard something fall to the ground.
おおかみが吠えているのが聞こえた。,お おかみ が ほえている の が きこえた。,I heard a wolf crying.
彼が下に降りてくる足音が聞こえた。,かれ が した に おりてくる あしおと が きこえた。,I heard him coming downstairs.
子供たちの楽しそうな声が聞こえた。,こどもたち の たのしそう な こえ が きこえた。,I heard the children's happy voices.
ちょっと、私が言ったこと、聞こえた？,ちょっと、わたし が いった こと、きこえた？,"Hey, did you hear me?"
おい、俺の言ってること、聞こえたのか？,おい、おれ の いってる こと、きこえた の か？,"Hey, did you hear me?"
私たちには近くの教会の鐘の音が聞こえた。,わたしたち には ちかく の きょうかい の かね の おと が きこえた。,We could hear the bells ringing from a nearby church.
トムが隣の部屋で笑っているのが聞こえた。,トム が となり の へや で わらっている の が きこえた。,I heard Tom laughing in the next room.
人込みの中で、誰かが私を呼ぶのが聞こえた。,ひとごみ の なか で、だれか が わたし を よぶ の が きこえた。,I heard someone call my name in the crowd.
私たちには砂利を踏みしめる足音が聞こえた。,わたしたち には じゃり を ふみしめる あしおと が きこえた。,We could hear footsteps crunching through the gravel.
彼がシャワーで鼻歌を歌っているのが聞こえた。,かれ が シャワー で はなうた を うたっている の が きこえた。,I heard him humming in the shower.
私を見つけるの？,わたし を みつける の？,Will you find me?
馬鹿につける薬はない。,ばか に つける くすり は ない。,There's no cure for stupidity.
探す人が、見つけるのだ。,さがす ひと が、みつける の だ。,"Who searches, finds."
トムを見つける必要がある。,トム を みつける ひつよう が ある。,I just need to find Tom.
英語を身につけるのは難しい。,えいご を み に つける の は むずかしい。,English is difficult to learn.
マスクをつけると眼鏡が曇る。,マスク を つけると めがね が くもる。,"When I wear a mask, my glasses get steamed up."
僕はもっと気をつけるべきだ。,ぼく は もっと き を つけるべきだ。,I should be more careful.
傷つけるつもりはなかったんだ。,きずつける つもり は なかっ た ん だ。,I didn't mean to hurt you.
ひげをそる前に石けんをつける。,ひげ を そる まえ に せっけん を つける。,I lather my face before shaving.
自分の考えを僕に押しつけるな。,じぶん の かんがえ を ぼく に おしつける な。,Don't press your opinion on me.
彼の家を見つけるのに苦労した。,かれ の いえ を みつける の に くろう した。,I had a hard time finding his house.
適当な訳を見つけるのが難しい。,てきとう な わけ を みつける の が むずかしい。,It's hard to find a suitable translation.
ビリさんは顔を窓によくぶつける。,ビリさん は かお を まど に よく ぶつける。,Billy often hits his face against windows.
好きなものが見つけると、高すぎる。,すき な もの が みつけると、たかすぎる。,"Whenever I find something I like, it's too expensive."
彼は毎日、日記をつける決心をした。,かれ は まいにち、にっき を つける けっしん を した。,He made up his mind to keep a diary every day.
彼女は毎日日記をつける習慣がある。,かのじょ は まいにち にっき を つける しゅうかん が ある。,She is in the habit of writing in her diary every day.
どの虫があなたを傷つけるんですか。,どの むし が あなた を きずつける ん です か。,Which bug hurt you?
宇宙でどうやって食べ物をみつけるの？,うちゅう で どう やって たべもの を みつける の？,How do you find food in outer space?
傷つけられた人は人を傷つけるものだ。,きずつけられた ひと は ひと を きずつける もの だ。,Hurt people hurt people.
剣で人を傷つける者は、剣で死ぬのだ。,けん で ひと を きずつける もの は、けん で しぬ の だ。,"He who wounds by the sword, dies by the sword."
良い革は何年ももつ。,よい かわ は なんねん も もつ。,Good leather will wear for years.
彼らは同じ習慣をもつ。,かれら は おなじ しゅうかん を もつ。,They have the same habits.
女の髪の毛には大象もつながる。,おんな の かみのけ には だい ぞう も つながる。,No man can resist the lure of a woman.
太股が筋肉痛で歩くのもつらい。,ふともも が きんにくつう で あるく の も つらい。,It hurts to even walk with my thigh muscles aching.
あなたには想像もつかない、でしょ？,あなた には そうぞう も つかない、でしょ？,"You can't imagine it, can you?"
「転がる石は苔をもつけず」はことわざである。,「ころがる いし は こけ をも つけず」は ことわざ である。,A rolling stone gathers no moss is a proverb.
何故彼女がそんなことしたのか想像もつかない。,なぜ かのじょ が そんな こと した の か そうぞう も つかない。,I cannot conceive why she has done such a thing.
彼を見るといつでもつい同情してしまうんです。,かれ を みると いつ でも つい どうじょう してしまう ん です。,I cannot help but sympathize with him any time I see him.
当時は、何が起きているのか想像もつかなかった。,とうじ は、なに が おきている の か そうぞう も つかなかった。,"At that time, I had no idea what was going to happen."
はっきり言うと、彼のスピーチはいつもつまらない。,はっきり いうと、かれ の スピーチ は いつも つまらない。,"Frankly speaking, his speeches are always dull."
ウチの犬は僕が部屋を出たらいつもついて来るんだ。,ウチ の いぬ は ぼく が へや を でたら いつも ついてくる ん だ。,My dog follows me whenever I leave the room.
君がこんなふるまいをするなんて想像もつかなかった。,きみ が こんな ふるまい を する なんて そうぞう も つかなかった。,I cannot see you behaving like that.
すねにきずもつ者は他人の批評などしないほうがよい。,すね に きず もつ もの は たにん の ひひょう など しない ほう が よい。,People who live in glass houses shouldn't throw stones.
どうでしたか。,どう でした か。,How was it?
安いようでした。,やすい よう でした。,It seemed to be cheap.
血は鮮血でした。,ち は せんけつ でした。,The blood was bright red.
私は教師でした。,わたし は きょうし でした。,I was a teacher.
お疲れ様でした。,おつかれさま でした。,Thanks for your hard work.
ご馳走様でした。,ごちそうさま でした。,That was a delicious meal.
昨日病気でした。,きのう びょうき でした。,Yesterday I was ill.
旅行どうでした？,りょこう どう でした？,How was your trip?
私は会員でした。,わたし は かいいん でした。,I was a member.
変化の時でした。,へんか の とき でした。,It was time for a change.
お疲れさまでした。,おつかれさま でした。,Thank you!
いつもそうでした。,いつも そう でした。,It's always been like that.
夏はどうでしたか。,なつ は どう でした か。,How was your summer?
旅行どうでしたか？,りょこう どう でした か？,How was your trip?
どうでした、旅行？,どう でした、りょこう？,How was your trip?
旅行はどうでした？,りょこう は どう でした？,How was your trip?
嬉しい驚きでした。,うれしい おどろき でした。,I was pleasantly surprised.
いい旅行でしたか？,いい りょこう でした か？,Was it a nice trip?
専攻は何でしたか？,せんこう は なに でした か？,What was your major?
トムは短命でした。,トム は たんめい でした。,Tom didn't live a long life.
君の案はよさそうだね。,きみ の あん は よさそう だ ね。,Your idea sounds like a good one.
走ったほうがよさそうだ。,はしった ほう が よさそう だ。,I must run.
外で話したほうがよさそうだ。,そと で はなした ほう が よさそう だ。,I think we'd better talk outside.
トムは興味がなさそうだった。,トム は きょうみ が なさそう だった。,Tom didn't seem interested.
もう出かけたほうがよさそうだ。,もう でかけた ほう が よさそう だ。,I may as well go now.
私たちは待った方がよさそうだ。,わたしたち は まった ほう が よさそう だ。,We may as well wait.
睡眠をとったほうがよさそうだ。,すいみん を とった ほう が よさそう だ。,I need sleep.
今日のトムは調子が良さそうだ。,きょう の トム は ちょうし が よさそう だ。,Tom looked good today.
トムは楽しくなさそうにしている。,トム は たのしく なさそう に している。,Tom is not looking happy.
クッキーは猫の名前に良さそうだ。,クッキー は ねこ の なまえ に よさそう だ。,Cookie would be a good name for a cat.
トムに相談したほうがよさそうだな。,トム に そうだん した ほう が よさそう だ な。,I think we'd better talk to Tom.
トムさんは晩御飯がいらなさそうです。,トムさん は ばん ごはん が いらなさそう です。,Tom doesn't want dinner.
今のところ、解決の見込みはなさそうだ。,いま の ところ、かいけつ の みこみ は なさそう だ。,"For the time being, there seems to be almost no hope of a solution."
彼は彼女のいる前ではとても照れくさそうにする。,かれ は かのじょ の いる まえ では とても てれくさそう に する。,He acts very shy in her presence.
トムはメアリーが何をしようと怒ることはなさそうだ。,トム は メアリー が なに を しよう と おこる こと は なさそう だ。,Tom never seems to get upset no matter what Mary does.
トムはリンゴの芯の取り方をやってみせてくれた。,トム は リンゴ の しん の とりかた を やってみせてくれた。,Tom demonstrated how to core an apple.
これよりもっと安いカメラをみせてくれませんか。,これ より もっと やすい カメラ を みせてくれません か。,Could you please show me a camera that's cheaper than this one?
恐れ入りますが、その写真をもう一度みせてください。,おそれいります が、その しゃしん を もういちど みせてください。,"Excuse me, but let me have another look at the photo."
中に入ってもらって。,なか に はいってもらって。,Let him in.
ねえ、それもらってもいい？,ねえ、それ もらっても いい？,"Hey, can I have that?"
手紙の返事をもらっていない。,てがみ の へんじ を もらっていない。,I've got no answer to my letter.
彼は高い給料をもらっている。,かれ は たかい きゅうりょう を もらっている。,He gets a good salary.
電話番号教えてもらってもいい？,でんわ ばんごう おしえてもらっても いい？,Can I have your telephone number?
二週間ほど貸してもらってもいい？,にしゅうかん ほど かしてもらっても いい？,Can I borrow one for about two weeks?
窓を閉めてもらってもいいですか？,まど を しめてもらっても いい です か？,Can you please close the window?
もう一度言ってもらっていいですか？,もういちど いってもらって いい です か？,Can you say that again?
明日の朝まで待っててもらってもいい？,あした の あさ まで まっててもらっても いい？,Could I ask you to wait until tomorrow morning?
学校で毎月新しい教科書をもらってる。,がっこう で まいつき あたらしい きょうかしょ を もらってる。,At school we get a new textbook every month.
彼女は月給ではなく日給をもらっている。,かのじょ は げっきゅう では なく にっきゅう を もらっている。,"She doesn't get paid by the month, but by the day."
ここにいてもらっても差し支えありません。,ここ に いてもらっても さしつかえありません。,You may stay here if you want to.
彼らはよく面倒を見てもらっているのです。,かれら は よく めんどう を みてもらっている の です。,They are well looked after.
この本をお母さんに読んでもらってください。,この ほん を おかあさん に よんでもらってください。,Here's a book for your mother to read.
私は長いこと彼から便りをもらっていません。,わたし は ながい こと かれ から たより を もらっていません。,I haven't heard from him for a long time.
私は長い間彼女から便りをもらっていません。,わたし は ながい ま かのじょ から たより を もらっていません。,I haven't heard from her for a long time.
別々にラッピングしてもらってもいいですか？,べつべつ に ラッピング してもらっても いい です か？,Could you wrap them up separately?
もう少しゆっくり話してもらっていいですか？,もうすこし ゆっくり はなしてもらって いい です か？,Can you speak a little slower please?
明日の2時半にまたここに来てもらってもいい？,あした の 2じはん に また ここ に きてもらっても いい？,Could you come back here again tomorrow at 2:30?
うん。前の先生に紹介してもらって、転院したの。,うん。まえ の せんせい に しょうかい してもらって、てんいん した の。,Yes. She got an introduction from her old doctor and transferred.
彼女は、めったに人と口をききませんでした。,かのじょ は、めったに ひと と くち を ききませんでした。,She rarely talked to anybody.
トムが一体何を考えていたのか、私はしらない。,トム が いったい なに を かんがえていた の か、わたし は しらない。,I don't know what Tom thought.
トムとはつきあわないほうがいいよ。,トム とは つきあわない ほう が いい よ。,I advise you not to keep company with Tom.
歯ブラシをくわえたまま走り回ってはいけません。,はぶらし を くわえた まま はしりまわってはいけません。,You shouldn't run around with a toothbrush in your mouth.
その子はまだみつかっていない。,その こ は まだ みつかっていない。,The boy is yet to be found.
いなくなった猫はまだ見つかってない。,いなく なった ねこ は まだ みつかってない。,The missing cat has not been found yet.
君がなくしていたお金が見つかって僕は嬉しい。,きみ が なくしていた おかね が みつかって ぼく は うれしい。,I'm glad you found the money you lost.
トムはテストでカンニングが見つかって退学になった。,トム は テスト で カンニング が みつかって たいがく に なった。,Tom was caught cheating on the exam and was expelled from school.
おかしくない？,おかしく ない？,Do I look OK?
忙しくなった。,いそがしく なった。,I got busy.
難しくはない。,むずかしく は ない。,It's not complicated.
悲しくないの？,かなしく ない の？,Aren't you sad?
どうぞよろしく。,どうぞ よろしく。,Pleased to meet you.
これ、難しくね？,これ、むずかしく ね？,Isn't it hard?
難しくはないさ。,むずかしく は ない さ。,It won't be hard.
皆さんによろしく。,みなさん に よろしく。,With kind regards to you all.
御両親によろしく。,ご りょうしん に よろしく。,Remember me to your parents.
水を少しください。,みず を すこし ください。,Please give me some water.
少しくれませんか。,すこし くれません か。,Will you give me some?
涼しくなってきた。,すずしく なってきた。,The weather is becoming cooler.
涼しくなりました。,すずしく なりました。,It has cooled off.
誰もうれしくない。,だれ も うれしく ない。,Nobody's happy.
悲しくなんかない。,かなしく なんか ない。,I'm not sad.
