japanese,kana,english
ご迷惑をおかけして申し訳ございません。,ご めいわく を おかけ して もうしわけ ございません。,Sorry to bother you.
ご面倒をお掛けして申し訳ございません。,ご めんどう を お かけして もうしわけ ございません。,We are sorry for the inconvenience.
ここまででご不明な点はございませんか？,ここ までで ご ふめい な てん は ございません か？,Has anything been unclear so far?
ご期待に添えず申し訳ございませんでした。,ご きたい に そえず もうしわけ ございませんでした。,I’m sorry I couldn't meet your expectations.
たいへんお手数をおかけしまして申し訳ございません。,たいへん おてすう を おかけ しまし て もうしわけ ございません。,I am sorry that I have troubled you so much.
大変申し訳ございませんが、もう品切れでございます。,たいへん もうしわけ ございません が、もう しなぎれ でございます。,"I'm sorry, but we're out of stock."
彼女は安物は身につけません。,かのじょ は やすもの は み に つけません。,She doesn't wear the cheap stuff.
彼はもうでかけてしまった。,かれ は もうでかけてしまった。,He's already left.
彼はいつも未来に目をむけている。,かれ は いつも みらい に め を むけている。,He is always looking to the future.
これ誰にもらったの？,これ だれ に もらった の？,Who gave you this?
それ誰にもらったの？,それ だれ に もらった の？,Who did you get that from?
彼から電話をもらった。,かれ から でんわ を もらった。,I had a phone call from him.
彼は一等賞をもらった。,かれ は いっとうしょう を もらった。,He got the first prize.
私は散髪をしてもらった。,わたし は さんぱつ を してもらった。,I got my hair cut.
時計を修理してもらった。,とけい を しゅうり してもらった。,I had my watch fixed.
私たちは養子をもらった。,わたしたち は ようし を もらった。,We adopted a child.
友人から手紙をもらった。,ゆうじん から てがみ を もらった。,I received a letter from my friend.
トムはパイを少しもらった。,トム は パイ を すこし もらった。,Tom got a small portion of pie.
トムは医者に診てもらった。,トム は いしゃ に みてもらった。,Tom saw a doctor.
伯父から砂時計をもらった。,おじ から すなどけい を もらった。,My uncle gave me an hourglass.
彼に時計を直してもらった。,かれ に とけい を なおしてもらった。,I had him repair my watch.
これ誰にもらったんですか？,これ だれ に もらった ん です か？,Who gave you this?
私は時計を修理してもらった。,わたし は とけい を しゅうり してもらった。,I had my watch repaired.
髭剃りと散髪をしてもらった。,ひげ すり と さんぱつ を してもらった。,I got a shave and a haircut.
彼に時計を修理してもらった。,かれ に とけい を しゅうり してもらった。,I had him repair my watch.
理科のテストでＤをもらった。,りか の テスト でＤを もらった。,I got a D on my science test.
髪を切ってもらった方がいいよ。,かみ を きってもらった ほう が いい よ。,You should get your hair cut.
医者に見てもらったほうがいい。,いしゃ に みてもらった ほう が いい。,You ought to see a doctor.
私は自転車を修理してもらった。,わたし は じてんしゃ を しゅうり してもらった。,I got my bicycle repaired.
クリスは素早く身をかわした！,クリス は すばやく み を かわした！,Chris nimbly dodged the attack!
わかりません。,わかりません。,I have no idea.
ラテン語はわかりません。,ラテン語 は わかりません。,I don't know the Latin language.
それが何かわかりません。,それ が なに か わかりません。,I don't know what that is.
料理の仕方がわかりません。,りょうり の しかた が わかりません。,I don't know how to cook.
真実は誰にもわかりません。,しんじつ は だれ にも わかりません。,Nobody knows the truth.
ドイツ語は全くわかりません。,ドイツご は まったく わかりません。,I don't understand German at all.
切符の買い方がわかりません。,きっぷ の かいかた が わかりません。,I don't know how to buy a ticket.
何と答えていいかわかりません。,なんと こたえて いい か わかりません。,I don't know how to reply to that question.
いくら考えても、わかりません。,いくら かんがえても、わかりません。,No matter how much I consider it I do not understand.
おっしゃる意味がわかりませんが。,おっしゃる いみ が わかりません が。,What you said does not make sense.
その単語のスペルがわかりません。,その たんご の スペル が わかりません。,I don't know how to spell the word.
チケットの買い方がわかりません。,チケット の かいかた が わかりません。,I don't know how to buy a ticket.
彼女が休んだ理由はわかりません。,かのじょ が やすんだ りゆう は わかりません。,I don't know the reason for her absence.
十分にお金があるかわかりません。,じゅうぶん に おかね が ある か わかりません。,I don't know if I have enough money.
彼がいつ戻ってくるかわかりません。,かれ が いつ もどってくる か わかりません。,I don't know when he'll come back.
いつ私が戻るか正確にはわかりません。,いつ わたし が もどる か せいかく には わかりません。,I don't know exactly when I will be back.
私はその単語のつづりがわかりません。,わたし は その たんご の つづり が わかりません。,I don't know how to spell the word.
ジョージが来るかどうかわかりません。,ジョージ が くる か どうか わかりません。,I don't know if George is coming or not.
どうお礼を言えばいいかわかりません。,どう おれい を いえば いい か わかりません。,How can I thank you?
どちらが良いか私たちにはわかりません。,どちら が よい か わたしたち には わかりません。,We cannot tell which is better.
私だったらやらないけどな。,わたし だったら やらない けどな。,"If I were you, I wouldn't do it."
父はたばこも酒もやらない。,ちち は たばこ も さけ も やらない。,My father neither smokes nor drinks.
私は酒もたばこもやらない。,わたし は さけ も たばこ も やらない。,I neither smoke nor drink.
遅くともやらないよりはまし。,おそくとも やらない よりは まし。,Better late than never.
私だったらやらないけどなあ。,わたし だったら やらない けどなあ。,"If I were you, I wouldn't do it."
その仕事はやらないでおこう。,その しごと は やらない でおこう。,Let's not do the work.
私の父は酒もたばこもやらない。,わたし の ちち は さけ も たばこ も やらない。,My father neither smokes nor drinks.
トムは決してそれをやらないだろう。,トム は けっして それ を やらないだろう。,Tom would never do that.
彼は本当に嫌いな事は滅多にやらない。,かれ は ほんとうに きらい な こと は めった に やらない。,He seldom does anything he really hates to do.
例えできるとしても、やらないだろう。,たとえできる としても、やらないだろう。,I wouldn't do it even if I could.
しばらくスカイプはやらないことにした。,しばらく スカイプ は やらない こと に した。,I decided to stop using Skype for a while.
僕たちと一緒にフットボールをやらないか。,ぼくたち と いっしょ に フットボール を やらない か。,Do you want to play football with us?
トムが二度とそれをやらないことを願うよ。,トム が にどと それ を やらない こと を ねがう よ。,I hope that Tom will never do that again.
やらないといけない事はまだたくさんあります。,やらない といけない こと は まだ たくさん あります。,There still remains much to be done.
つべこべうるさいよ。やるのかやらないのか！？,つべこべ うるさい よ。やる の か やらない の か！？,"Quit your bellyaching. You goin' to do it, or not!?"
トムがやらないのなら僕はがっかりするだろう。,トム が やらない の なら ぼく は がっかり するだろう。,"If Tom doesn't do that, I'll be disappointed."
もし気にさわったら、ごめん。,もし き に さわったら、ごめん。,I apologize if I hurt your feelings.
トムはすっかり疲れきっていた。,トム は すっかり つかれきっていた。,Tom was all worn out.
彼は骨の髄まで腐りきっている。,かれ は ほね の ずい まで くさりきっている。,He is rotten to the core.
田中くんは省内きっての馬鹿者だよ。,たなかくん は しょうない きっての ばかしゃ だ よ。,Young Tanaka is the stupidest person in the department.
春巻きってなんで春巻きっていうか知ってる？,はるまき ってなんで はるまき っていうか しってる？,Do you know why spring rolls are called spring rolls?
お薬は処方された通りに飲みきってくださいね。,お くすり は しょほう された とおり に のみきってください ね。,Please take all of your medicine as prescribed.
私は頂上に着いたとき、すっかり疲れきっていた。,わたし は ちょうじょう に ついた とき、すっかり つかれきっていた。,"When I reached the summit, I was thoroughly worn out."
部屋は暖かかった。,へや は あたたかかっ た。,The room was warm.
彼は風邪にかかった。,かれ は かぜ に かかった。,He came down with a cold.
彼は流感にかかった。,かれ は りゅうかん に かかった。,He came down with the flu.
本当に柔らかかった！,ほんとうに やわらかかっ た！,It was really soft!
彼の唇は温かかった。,かれ の くちびる は あたたかかっ た。,His lips were warm.
彼は壁に寄りかかった。,かれ は かべ に よりかかった。,He leaned against the wall.
この机は２万円かかった。,この つくえ は ２まんえん かかった。,"This desk cost me 20,000 yen."
次の問題にとりかかった。,つぎ の もんだい に とりかかった。,He proceeded to the next question.
家の中はとても暖かかった。,いえ の なか は とても あたたかかっ た。,It was nice and warm inside the house.
彼らは家の建築にとりかかった。,かれら は いえ の けんちく に とりかかった。,They set about building a house.
トムはメアリーに寄りかかった。,トム は メアリー に よりかかった。,Tom leaned towards Mary.
かぜが治るまでに一ヶ月かかった。,かぜ が なおる までに いちヶ月 かかった。,It took me a month to get over my cold.
かぜがなおるのに３週間かかった。,かぜ が なおる の に ３しゅうかん かかった。,It took three weeks for me to get over my cold.
隣の村まで歩いて１時間かかった。,となり の むら まで あるいて １じかん かかった。,An hour's walk brought me to the next village.
富士山に登るのに丸一晩かかった。,ふじさん に のぼるのに まる いちばん かかった。,It took all night to climb Mt Fuji.
車の修理にかなりお金がかかった。,くるま の しゅうり に かなり おかね が かかった。,It cost a lot of money to repair the car.
車を修理するのに大変金がかかった。,くるま を しゅうり する の に たいへんきん が かかった。,It cost me a fortune to get my car repaired.
旅行中に私はひどい風邪にかかった。,りょこうちゅう に わたし は ひどい かぜ に かかった。,I caught a bad cold during the trip.
トムはメアリーの罠にひっかかった。,トム は メアリー の わな に ひっかかった。,Tom has fallen for Mary's trap.
どうやらひどい風邪にかかったようだ。,どうやら ひどい かぜ に かかった よう だ。,I seem to have caught a bad cold.
昨日家に帰る中に夕立にあいました。,きのうか に かえる なか に ゆうだち に あいました。,I was caught in a shower on my way home yesterday.
私は家に帰る途中でにわか雨にあいました。,わたし は いえ に かえる とちゅう で にわかあめ に あいました。,I was caught in a shower on my way home.
君は学生にすぎない。,きみ は がくせい に すぎない。,You are nothing but a student.
彼は臆病者にすぎない。,かれ は おくびょうもの に すぎない。,He is nothing more than a coward.
飲みすぎないようにね。,のみすぎない よう にね。,Be careful not to drink too much.
彼はうそつきにすぎない。,かれ は うそつき に すぎない。,He is nothing but a liar.
愛は作りごとにすぎない。,あい は つくりごと に すぎない。,Love is only an invention.
そのスカート、短すぎない？,その スカート、みじかすぎない？,Isn't that skirt too short?
あんまり期待しすぎないでね。,あんまり きたい しすぎないで ね。,Don't get your hopes up too much.
人生は、はかない夢にすぎない。,じんせい は、はかない ゆめ に すぎない。,Life is but an empty dream.
心配しすぎないで。大丈夫だよ。,しんぱい しすぎない で。だいじょうぶ だ よ。,Don't worry too much. It's okay.
前髪は短く切りすぎないでください。,まえがみ は みじかく きりすぎない でください。,Don't cut it too short in the front.
そんなことやっても時間の無駄にすぎない。,そんな こと やっても じかん の むだ に すぎない。,Trying to do such a thing is a waste of time.
あんまり期待しすぎない方がいいと思うよ。,あんまり きたい しすぎない ほう が いい と おもう よ。,Don't get your hopes up too much.
君の言っていることは机上の空論にすぎないよ。,きみ の いっている こと は きじょう の くうろん に すぎない よ。,What you are saying is nothing but building a castle in the air.
彼女は彼に砂糖を使いすぎないように忠告した。,かのじょ は かれ に さとう を つかいすぎない よう に ちゅうこく した。,She advised him not to use too much sugar.
夜そんなに遅くコーヒーを飲みすぎない方がいいよ。,よる そんなに おそく コーヒー を のみすぎない ほう が いい よ。,You'd better not drink too much coffee so late at night.
彼女は砂糖を使いすぎないように彼にアドバイスした。,かのじょ は さとう を つかいすぎない よう に かれ に アドバイス した。,She advised him not to use too much sugar.
あんまり考えすぎないでね。人生まだまだ長いんだし。,あんまり かんがえすぎないで ね。じんせい まだまだ ながい ん だ し。,Don’t worry about it too much. You’ve still got such a long life ahead of you.
今しかない。,いま しか ない。,It's now or never.
待つしかない。,まつ しか ない。,I can only wait.
謝るしかない。,あやまる しか ない。,There is nothing to do but apologize.
働くしかない。,はたらく しか ない。,We have no alternative but to work.
殺すしかない。,ころす しか ない。,We have no choice but to kill.
あと1日しかない。,あと 1にち しか ない。,There's only a day left.
一人で行くしかない。,いちにん で いく しか ない。,You have to go alone.
2月は28日しかない。,2 つき は 28にち しか ない。,February has only 28 days.
警察の到着を待つしかない。,けいさつ の とうちゃく を まつ しか ない。,All we can do is wait for the police to arrive.
2月は28日までしかない。,2 つき は 28にち までしか ない。,February has only 28 days.
我々にはあと三日しかない。,われわれ には あと さんにち しか ない。,We only have three days left.
お互いを信頼し合うしかない。,おたがい を しんらい しあう しか ない。,All you can do is trust one another.
彼は単なる愚か者でしかない。,かれ は たんなる おろかもの でしか ない。,He is nothing but a fool.
レジは1階にしかないんですか？,レジ は 1かい にしか ない ん です か？,Is there a check-out on the first floor only?
結局は誰でも自分で学ぶしかない。,けっきょく は だれ でも じぶん で まなぶ しか ない。,Everyone must learn on their own in the end.
その村までたった3マイルしかない。,その むら まで たった 3マイル しか ない。,It's only three miles to the village.
今彼の頭には彼女に会うことしかない。,いま かれ の あたま には かのじょ に あう こと しか ない。,The only thing he's thinking about is seeing her.
僕は間違いも犯す一人の少年でしかない。,ぼく は まちがい も おかす いちにん の しょうねん でしか ない。,I'm just a boy who makes mistakes.
そのラジオはマッチ箱の大きさしかない。,その ラジオ は マッチばこ の おおきさ しか ない。,That radio is no bigger than a matchbox.
この取り決めは一時的なものでしかない。,この とりきめ は いちじてき な もの で しか ない。,This arrangement is only temporary.
コーヒーふたつ下さい。,コーヒー ふたつください。,"Two coffees, please."
時のたつのは早いものだ。,とき の たつ の は はやい もの だ。,Time flies.
時間がたつのを忘れてしまった。,じかん が たつ の を わすれてしまった。,I lost track of time.
わたしの家には階段がふたつある。,わたし の いえ には かいだん が ふたつ ある。,There are two staircases in my house.
好きなことをしていると時のたつのが速い。,すき な こと を していると とき の たつ の が はやい。,Time passes quickly when we are doing something we like.
来年の３月で君は英語を学んで４年たつことになる。,らいねん の さんがつ で きみ は えいご を まなんで ４ねん たつ こと に なる。,You will have studied English for four years next March.
トムが会議に参加するとは思ってもみなかったよ。,トム が かいぎ に さんか する とは おもっても みなかった よ。,I didn't expect Tom to be at the meeting.
その事件を目撃したのに何もみなかったふりをした。,その じけん を もくげき した のに なに も みなかった ふり を した。,"Even though I witnessed the incident, I pretended not to have seen anything."
メアリーがそんなに早く来るとは思ってもみなかった。,メアリー が そんなに はやく くる とは おもっても みなかった。,I didn't expect that Mary would come so soon.
違うんだ。,ちがう ん だ。,Wrong.
明日、携帯買うんだよ。,あした、けいたい かう ん だ よ。,I'm going to buy a cell phone tomorrow.
俺はお前とは違うんだ。,おれ は おまえ とは ちがう ん だ。,I am not like you.
トムはお前とは違うんだよ。,トム は おまえ とは ちがう ん だ よ。,Tom isn't like you.
みんな僕のこと悪く言うんだ。,みんな ぼく の こと わるく いう ん だ。,Everybody puts me down.
なんでそんなこと言うんだよ？,なんで そんな こと いう ん だ よ？,Why do you say that?
じゃあどうしろって言うんだよ。,じゃあ どう しろ って いう ん だ よ。,What do you suggest I do then?
こんな高いもの誰が買うんだろう。,こんな たかい もの だれ が かう ん だろう。,I wonder who would buy an expensive thing like this.
誰がそんなことをするっていうんだ？,だれ が そんな こと を する っていう ん だ？,Why would anybody do something like that?
僕は学問には向いていないと思うんだ。,ぼく は がくもん には むいていない と おもう ん だ。,I think that I'm not academically oriented.
一体トムが君に何をしたっていうんだ。,いったい トム が きみ に なに を した って いう ん だ。,What did Tom ever do to you?
いつか、綿菓子をつくる機械を買うんだ。,いつか、めん かし を つくる きかい を かう ん だ。,Someday I will buy a cotton candy machine.
彼女が俺に一緒に来て欲しいと言うんだ。,かのじょ が おれ に いっしょ に きて ほしい と いう ん だ。,She says that she wants me to come with her.
なぜか勉強を始めると眠くなっちゃうんだ。,なぜ か べんきょう を はじめると ねむく なっちゃう ん だ。,"For some reason, I feel sleepy when I start studying."
君の名前は？僕は「パウロ」っていうんだ。,きみ の なまえ は？ぼく は「パウロ」っていう ん だ。,Your name? I'm Paulo.
そんなもの持ち出して一体何をしようというんだ？,そんな もの もちだして いったい なに を しよう という ん だ？,What the hell are you going to do with it?
そこらへんは、男子と女子とでは違うんだってば。,そこら へん は、だんし と じょし とでは ちがう ん だってば。,Obviously that's different for men and women.
君は僕がずっと待ち続けていた女性だと思うんだ。,きみ は ぼく が ずっと まちつづけていた じょせい だ と おもう ん だ。,I think you're the woman I've been waiting for all my life.
彼女、方向音痴だから、すぐに道に迷っちゃうんだ。,かのじょ、ほうこう おんち だ から、すぐ に みち に まよっちゃ うんだ。,She gets lost really easily. She's got no sense of direction.
ノリノリの音楽がかかると、つい踊っちゃうんだよね。,ノリノリ の おんがく が かかると、つい おどっちゃう ん だ よね。,"When really lively music starts playing, I start dancing unconsciously."
「人は見かけによらない」とはよく言ったものですね。,「ひと は みかけ に よらない」とは よく いった もの です ね。,"It's well said that ""You can't judge people by their appearance"", isn't it?"
うまくいった。,うまく いった。,That worked.
うまく行った！,うまく いった！,It worked.
全部うまくいくよ。,ぜんぶ うまく いく よ。,Everything will be fine.
うまく行くと思うよ。,うまく いく と おもう よ。,I think it will be okay.
面接はうまくいった？,めんせつ は うまく いった？,Did the interview go well?
手術がうまくいった。,しゅじゅつ が うまく いった。,The surgery went well.
彼はうまく歌えません。,かれ は うまく うたえません。,He can't sing well.
結果的にうまくいった。,けっかてき に うまく いった。,It turned out well.
料理うまくなりたいな。,りょうり うまく なりたい な。,I want to get better at cooking.
お前ならうまくやれるよ。,おまえ なら うまく やれる よ。,I know you can make it.
面接はうまくいきました！,めんせつ は うまく いきました！,I did well at the interview!
トムは袖をまくり上げた。,トム は そで を まくりあげた。,Tom rolled up his sleeves.
英語すごくうまくなったね。,えいご すごく うまく なった ね。,Your English has improved a lot.
彼はうまく泳げると言った。,かれ は うまく およげる と いった。,He said he could swim well.
彼はうまく泳げると答えた。,かれ は うまく およげる と こたえた。,He answered that he could swim well.
彼女はかなりうまく歌った。,かのじょ は かなり うまく うたった。,She sang pretty well.
うまくいったと思ったのに。,うまく いった と おもった のに。,I thought that went well.
ねえ、万事うまく行ってる？,ねえ、ばんじ うまく いってる？,"Hey, is everything all right?"
英語をうまく話すのは難しい。,えいご を うまく はなす の は むずかしい。,It is not easy to speak English well.
私の英語は決してうまくない。,わたし の えいご は けっして うまく ない。,My English is anything but good.
